{
  "artifact_type": "public-scenario-result",
  "associated_files": [
    {
      "reference": "results/public/summaries/run-20260723-055025-checks.json",
      "sha256": "613f8013c7f2ab3177e0f24d14c47e00e0cf1646eafab3b1547894468edc253e"
    }
  ],
  "command_label": "Isolated LTE ZMQ simulation validation",
  "duration_seconds": 75,
  "ended_at_utc": "2026-07-23T05:51:40Z",
  "environment_reference": "results/public/environment/verification-host-20260723.json",
  "execution_status": "PASS",
  "limitations": [
    "Software-only ZMQ result; no SDR, commercial UE, IMS, voice, RF, or hardware claim.",
    "The result was executed in one isolated ephemeral Docker daemon on one host."
  ],
  "public_configurations": [
    {
      "reference": "config/profiles/4g-lte-sim.yaml",
      "sha256": "6ff482055702766671f70dfb092ea162baf1e79ec153094351128c1866cf28ea"
    },
    {
      "reference": "deployments/4g-lte-sim/docker-compose.yml",
      "sha256": "f4242cd68a8a4b65cd4c2736914cf213b442fe6c6610cbbcc21435453c605c37"
    }
  ],
  "release_version": "1.0.0-rc.1",
  "result_classification": "SIMULATION_ONLY",
  "run_id": "run-20260723-055025",
  "scenario": "4g-lte-sim",
  "schema_version": "1.0",
  "source_commit": "12c4a38404bbaf240c698a056e3f47182081ab5c",
  "started_at_utc": "2026-07-23T05:50:25Z",
  "success_criteria": [
    {
      "description": "Default bearer check passes",
      "evidence_references": [
        "results/public/summaries/run-20260723-055025-checks.json"
      ],
      "id": "default-bearer",
      "outcome": "MET"
    },
    {
      "description": "Core services pass the scenario checks",
      "evidence_references": [
        "results/public/summaries/run-20260723-055025-checks.json"
      ],
      "id": "epc-services",
      "outcome": "MET"
    },
    {
      "description": "S1 setup check passes",
      "evidence_references": [
        "results/public/summaries/run-20260723-055025-checks.json"
      ],
      "id": "s1-setup",
      "outcome": "MET"
    },
    {
      "description": "Data ping passes from the software UE",
      "evidence_references": [
        "results/public/summaries/run-20260723-055025-checks.json"
      ],
      "id": "ue-data-ping",
      "outcome": "MET"
    },
    {
      "description": "Software UE interface and address checks pass",
      "evidence_references": [
        "results/public/summaries/run-20260723-055025-checks.json"
      ],
      "id": "ue-interface",
      "outcome": "MET"
    },
    {
      "description": "Software UE registration passes",
      "evidence_references": [
        "results/public/summaries/run-20260723-055025-checks.json"
      ],
      "id": "ue-registration",
      "outcome": "MET"
    }
  ]
}
